[
  {
    "id": "core_armor_gambeson_armor",
    "name": { "en-US": "Gambeson Armor" },
    "tier": 1,
    "baseScore": 3,
    "baseDamageThresholds": { "major": 5, "severe": 11 },
    "features": [
      {
        "name": { "en-US": "Flexible" },
        "description": [{ "paragraph": { "en-US": "+1 to Evasion" } }]
      }
    ]
  },
  {
    "id": "core_armor_leather_armor",
    "name": { "en-US": "Leather Armor" },
    "tier": 1,
    "baseScore": 3,
    "baseDamageThresholds": { "major": 6, "severe": 13 }
  },
  {
    "id": "core_armor_chainmail_armor",
    "name": { "en-US": "Chainmail Armor" },
    "tier": 1,
    "baseScore": 4,
    "baseDamageThresholds": { "major": 7, "severe": 15 },
    "features": [
      {
        "name": { "en-US": "Heavy" },
        "description": [{ "paragraph": { "en-US": "−1 to Evasion" } }]
      }
    ]
  },
  {
    "id": "core_armor_full_plate_armor",
    "name": { "en-US": "Full Plate Armor" },
    "tier": 1,
    "baseScore": 4,
    "baseDamageThresholds": { "major": 8, "severe": 17 },
    "features": [
      {
        "name": { "en-US": "Very Heavy" },
        "description": [
          { "paragraph": { "en-US": "−2 to Evasion; −1 to Agility" } }
        ]
      }
    ]
  },
  {
    "id": "core_armor_improved_gambeson_armor",
    "name": { "en-US": "Improved Gambeson Armor" },
    "tier": 2,
    "baseScore": 4,
    "baseDamageThresholds": { "major": 7, "severe": 16 },
    "features": [
      {
        "name": { "en-US": "Flexible" },
        "description": [{ "paragraph": { "en-US": "+1 to Evasion" } }]
      }
    ]
  },
  {
    "id": "core_armor_improved_leather_armor",
    "name": { "en-US": "Improved Leather Armor" },
    "tier": 2,
    "baseScore": 4,
    "baseDamageThresholds": { "major": 9, "severe": 20 }
  },
  {
    "id": "core_armor_improved_chainmail_armor",
    "name": { "en-US": "Improved Chainmail Armor" },
    "tier": 2,
    "baseScore": 5,
    "baseDamageThresholds": { "major": 11, "severe": 24 },
    "features": [
      {
        "name": { "en-US": "Heavy" },
        "description": [{ "paragraph": { "en-US": "−1 to Evasion" } }]
      }
    ]
  },
  {
    "id": "core_armor_improved_full_plate_armor",
    "name": { "en-US": "Improved Full Plate Armor" },
    "tier": 2,
    "baseScore": 5,
    "baseDamageThresholds": { "major": 13, "severe": 28 },
    "features": [
      {
        "name": { "en-US": "Very Heavy" },
        "description": [
          { "paragraph": { "en-US": "−2 to Evasion; −1 to Agility" } }
        ]
      }
    ]
  },
  {
    "id": "core_armor_elundrian_chain_armor",
    "name": { "en-US": "Elundrian Chain Armor" },
    "tier": 2,
    "baseScore": 4,
    "baseDamageThresholds": { "major": 9, "severe": 21 },
    "features": [
      {
        "name": { "en-US": "Warded" },
        "description": [
          {
            "paragraph": {
              "en-US": "You reduce incoming magic damage by your Armor Score before applying it to your damage thresholds."
            }
          }
        ]
      }
    ]
  },
  {
    "id": "core_armor_harrowbone_armor",
    "name": { "en-US": "Harrowbone Armor" },
    "tier": 2,
    "baseScore": 4,
    "baseDamageThresholds": { "major": 9, "severe": 21 },
    "features": [
      {
        "name": { "en-US": "Resilient" },
        "description": [
          {
            "paragraph": {
              "en-US": "Before you mark your last Armor Slot, roll a d6. On a result of 6, reduce the severity by one threshold without marking an Armor Slot."
            }
          }
        ]
      }
    ]
  },
  {
    "id": "core_armor_irontree_breastplate_armor",
    "name": { "en-US": "Irontree Breastplate Armor" },
    "tier": 2,
    "baseScore": 4,
    "baseDamageThresholds": { "major": 9, "severe": 20 },
    "features": [
      {
        "name": { "en-US": "Reinforced" },
        "description": [
          {
            "paragraph": {
              "en-US": "When you mark your last Armor Slot, increase your damage thresholds by +2 until you clear at least 1 Armor Slot."
            }
          }
        ]
      }
    ]
  },
  {
    "id": "core_armor_runetan_floating_armor",
    "name": { "en-US": "Runetan Floating Armor" },
    "tier": 2,
    "baseScore": 4,
    "baseDamageThresholds": { "major": 9, "severe": 20 },
    "features": [
      {
        "name": { "en-US": "Shifting" },
        "description": [
          {
            "paragraph": {
              "en-US": "When you are targeted for an attack, you can mark an Armor Slot to give the attack roll against you disadvantage."
            }
          }
        ]
      }
    ]
  },
  {
    "id": "core_armor_tyris_soft_armor",
    "name": { "en-US": "Tyris Soft Armor" },
    "tier": 2,
    "baseScore": 5,
    "baseDamageThresholds": { "major": 8, "severe": 18 },
    "features": [
      {
        "name": { "en-US": "Quiet" },
        "description": [
          {
            "paragraph": {
              "en-US": "You gain a +2 bonus to rolls you make to move silently."
            }
          }
        ]
      }
    ]
  },
  {
    "id": "core_armor_rosewild_armor",
    "name": { "en-US": "Rosewild Armor" },
    "tier": 2,
    "baseScore": 5,
    "baseDamageThresholds": { "major": 11, "severe": 23 },
    "features": [
      {
        "name": { "en-US": "Hopeful" },
        "description": [
          {
            "paragraph": {
              "en-US": "When you would spend a Hope, you can mark an Armor Slot instead."
            }
          }
        ]
      }
    ]
  },
  {
    "id": "core_armor_advanced_gambeson_armor",
    "name": { "en-US": "Advanced Gambeson Armor" },
    "tier": 3,
    "baseScore": 5,
    "baseDamageThresholds": { "major": 9, "severe": 23 },
    "features": [
      {
        "name": { "en-US": "Flexible" },
        "description": [{ "paragraph": { "en-US": "+1 to Evasion" } }]
      }
    ]
  },
  {
    "id": "core_armor_advanced_leather_armor",
    "name": { "en-US": "Advanced Leather Armor" },
    "tier": 3,
    "baseScore": 5,
    "baseDamageThresholds": { "major": 11, "severe": 27 }
  },
  {
    "id": "core_armor_advanced_chainmail_armor",
    "name": { "en-US": "Advanced Chainmail Armor" },
    "tier": 3,
    "baseScore": 6,
    "baseDamageThresholds": { "major": 13, "severe": 31 },
    "features": [
      {
        "name": { "en-US": "Heavy" },
        "description": [{ "paragraph": { "en-US": "−1 to Evasion" } }]
      }
    ]
  },
  {
    "id": "core_armor_advanced_full_plate_armor",
    "name": { "en-US": "Advanced Full Plate Armor" },
    "tier": 3,
    "baseScore": 6,
    "baseDamageThresholds": { "major": 15, "severe": 35 },
    "features": [
      {
        "name": { "en-US": "Very Heavy" },
        "description": [
          { "paragraph": { "en-US": "−2 to Evasion; −1 to Agility" } }
        ]
      }
    ]
  },
  {
    "id": "core_armor_bellamoi_fine_armor",
    "name": { "en-US": "Bellamoi Fine Armor" },
    "tier": 3,
    "baseScore": 5,
    "baseDamageThresholds": { "major": 11, "severe": 27 },
    "features": [
      {
        "name": { "en-US": "Gilded" },
        "description": [{ "paragraph": { "en-US": "+1 to Presence" } }]
      }
    ]
  },
  {
    "id": "core_armor_dragonscale_armor",
    "name": { "en-US": "Dragonscale Armor" },
    "tier": 3,
    "baseScore": 5,
    "baseDamageThresholds": { "major": 11, "severe": 27 },
    "features": [
      {
        "name": { "en-US": "Impenetrable" },
        "description": [
          {
            "paragraph": {
              "en-US": "Once per short rest, when you would mark your last Hit Point, you can instead mark a Stress."
            }
          }
        ]
      }
    ]
  },
  {
    "id": "core_armor_spiked_plate_armor",
    "name": { "en-US": "Spiked Plate Armor" },
    "tier": 3,
    "baseScore": 5,
    "baseDamageThresholds": { "major": 10, "severe": 25 },
    "features": [
      {
        "name": { "en-US": "Sharp" },
        "description": [
          {
            "paragraph": {
              "en-US": "On a successful attack against a target within Melee range, add a d4 to the damage roll."
            }
          }
        ]
      }
    ]
  },
  {
    "id": "core_armor_bladefare_armor",
    "name": { "en-US": "Bladefare Armor" },
    "tier": 3,
    "baseScore": 6,
    "baseDamageThresholds": { "major": 16, "severe": 39 },
    "features": [
      {
        "name": { "en-US": "Physical" },
        "description": [
          {
            "paragraph": {
              "en-US": "You can’t mark an Armor Slot to reduce magic damage."
            }
          }
        ]
      }
    ]
  },
  {
    "id": "core_armor_monetts_cloak",
    "name": { "en-US": "Monett’s Cloak" },
    "tier": 3,
    "baseScore": 6,
    "baseDamageThresholds": { "major": 16, "severe": 39 },
    "features": [
      {
        "name": { "en-US": "Magic" },
        "description": [
          {
            "paragraph": {
              "en-US": "You can’t mark an Armor Slot to reduce physical damage."
            }
          }
        ]
      }
    ]
  },
  {
    "id": "core_armor_runes_of_fortification",
    "name": { "en-US": "Runes of Fortification" },
    "tier": 3,
    "baseScore": 6,
    "baseDamageThresholds": { "major": 17, "severe": 43 },
    "features": [
      {
        "name": { "en-US": "Painful" },
        "description": [
          {
            "paragraph": {
              "en-US": "Each time you mark an Armor Slot, you must mark a Stress."
            }
          }
        ]
      }
    ]
  },
  {
    "id": "core_armor_legendary_gambeson_armor",
    "name": { "en-US": "Legendary Gambeson Armor" },
    "tier": 4,
    "baseScore": 6,
    "baseDamageThresholds": { "major": 11, "severe": 32 },
    "features": [
      {
        "name": { "en-US": "Flexible" },
        "description": [{ "paragraph": { "en-US": "+1 to Evasion" } }]
      }
    ]
  },
  {
    "id": "core_armor_legendary_leather_armor",
    "name": { "en-US": "Legendary Leather Armor" },
    "tier": 4,
    "baseScore": 6,